Date,Session,StartDate,StartTime,EndDate,EndTime,Invited,Presenter,Presenter's Affiliation,In-Person/Remote,Coauthors,Coauthors affiliation,Paper Title,Abstract
07/15/22,Condensed Matter Physics and Material Science,07/15/22,10:45 PM,07/15/22,11:00 PM,,Sujan Shrestha,"Department of Physics and Astronomy, University of Kentucky",Remote,Maximilian Krautloher; Menglin Zhu; Jiwoong Kim; Jinwoo Hwang; Jungho Kim; Jong Woo Kim; Bernhard Keimer; Ambrose Seo,"Max-Planck-Institut für Festkörperforschung; Department of Materials Science and Engineering, The Ohio State University; Department of Physics and Astronomy, University of Kentucky; Department of Materials Science and Engineering, The Ohio State University; Advanced Photon Source, Argonne National Laboratory; Advanced Photon Source, Argonne National Laboratory; Max-Planck-Institut für Festkörperforschung; Department of Physics and Astronomy, University of Kentucky",Emergent La2CuO4-like interlayer antiferromagnetic magnetic order induced via orthorhombic-distortion in Sr2IrO4,We report a distinct La2CuO4-like interlayer antiferromagnetic stacking order in Sr2IrO4 thin films by introducing large orthorhombic distortion (> 1.5%) via anisotropic biaxial lattice strain in Sr2IrO4/Ca3Ru2O7 heterostructures. The orthorhombic distortion stabilizes the Jeff = ½ pseudospin moment direction along the longer lattice direction via magnetic anisotropy while it lead to non-zero interlayer exchange interaction energy. Resonant X-ray magnetic scattering confirms that the magnetic moment is parallel to the elongated b-axis whereas its stacking pattern is inverted from that of the tetragonal Sr2IrO4 crystal. This combination corresponds to the La2CuO4-type interlayer antiferromagnetic order which can be explained by the competition between interlayer interaction energies such that the net asymmetric interlayer exchange interaction energy between a and b-axes exceed the interlayer pseudo-dipolar interaction energy. Our result suggests that anisotropic strain-induced orthorhombic distortion provides a delicate knob for tuning the long-range magnetic order and enhancing the magnetic quantum fluctuations in quasi-two-dimensional systems.
07/15/22,Condensed Matter Physics and Material Science,07/15/22,11:00 PM,07/15/22,11:15 PM,,Jhulan Powrel,Tribhuvan University,Remote,Rajendra Prasad Koirala,Central Department of Physics; Central Department of Physics,"Binding Free Energy of Sickle and Normal Hemoglobin Dimer Protein: Umbrella Sampling Molecular Dynamics"".","This study focuses on investigation of the binding mechanism of different chains of hemoglobin under the mutated condition which can give the understanding on the molecular distortion. In this work, we have studied the binding mechanism between two chains of R-state conformation of carbonmonoxyl sickle hemoglobin and is compared with that of normal hemoglobin by using molecular dynamics simulations. The binding strength has been analyzed by estimating hydrogen bonding, salt bridges, hydrophobic interactions and non-bonded interactions (electrostatics and van der Waals). The comparative outcomes in two structures show that the binding strength of ?? and ?? chains in normal hemoglobin is higher than that of sickle hemoglobin due to vdW and electrostatic interaction in between chain ?? and chains ?? in the dimer showing the favorable binding in normal hemoglobin
than sickle. Structural stability is controlled by hydrophobic interactions of both protein. The sickling is occurring due to higher hydrophobic interaction of sickle than of normal hemoglobin. Binding strength of the molecule have also been investigated by estimating binding free energy, utilizing umbrella sampling technique. The binding free energy difference in sickle and normal hemoglobin dimer is found to be ? 0.67 kcal/mol. The results given by the aforementioned interactions are also supported by binding free energy calculation."
07/15/22,Condensed Matter Physics and Material Science,07/15/22,11:15 PM,07/15/22,11:30 PM,,Yogesh Singh Maharjan,"Amrit Campus, Tribhuvan University ",Remote,Dinesh Kumar Chaudhari; Leela Pradhan Joshi,Central Department of Physics; Amrit Campus,EFFECT OF THICKNESS ON ZnO THIN FILM PREPARED BY DIP COATING TECHNIQUE FOR ETHONAL SENSING,0.5M Zinc Oxide (ZnO) nano-particle thin films were deposited on cleaned glass substrates by dip coating technique with 350 mm/min dipping speed. These films were optically characterized using UV-Vis spectrophotometer. The band gap of film was found to be 3.11 eV having thickness 903.176 nm. Thickness was measured using a Swanepoel method. The refractive index of ZnO was also measured and its value was found to be 2.091 -1.532 in the wavelength of 350-800 nm. The prepared ZnO thin film was used to detect ethanol vapor in the temperature range 180 to 300 ºC. The highest response of 3.4 was found at the operating temperature of 240 ºC for 500 ppm of ethanol vapor. Corresponding response and recovery times were found as 9.82 and 16.33 sec respectively.  
07/15/22,Condensed Matter Physics and Material Science,07/15/22,11:30 PM,07/15/22,11:45 PM,,Sabin Regmi,"Department of Physics, University of Central Florida, Florida 32816, USA",Remote,Gyanendra Dhakal; Fairoja Cheenicode Kabeer; Neil Harrison; Firoza Kabir; Anup Pradhan Sakhya; Krzysztof Gofryk; Dariusz Kaczorowski;  Peter M. Oppeneer; Madhab Neupane,"University of Central Florida; Uppsala University; 3National High Magnetic Field Laboratory, Los Alamos;  University of Central Florida; University of Central Florida; Idaho National Laboratory; Polish Academy of Sciences; Uppsala University; University of Central Florida",Observation of multiple nodal-lines in SmSbTe,"The ZrSiS-type  LnSbTe (Ln = lanthanide elements) materials have been attracting research studies due to possible magnetism and correlation effects carried by 4f electrons of the lanthanide elements, therefore providing important platform  to study the interplay among topology, magnetism, and correlation. Here, we report the electronic structure of SmSbTe measured by using angle-resolved photoemission spectroscopy along with parallel first-principles calculations, transport, and magnetic measurements. Our results identify multiple Dirac nodes along the ? – X and Z – R directions that correspond to the nodal-lines predicted by our theoretical calculations. A surface Dirac-like state is also observed at the X point of the surface Brillouin zone. Our study highlights SmSbTe as a promising candidate to understand the topological electronic structure of LnSbTe materials.

This project is supported by the National Science Foundation (NSF) CAREER award DMR-1847962, the Air Force Office of Scientific Research under award number FA9550-17-1-0415, the Air Force Office of Scientific Research MURI Grant No. FA9550-20-1-0322, and the Center for Thermal Energy Transport under Irradiation, an Energy Frontier Research Center funded by the U.S. DOE, Office of Basic Energy Sciences."
07/15/22,Condensed Matter Physics and Material Science,07/15/22,11:45 PM,07/16/22,12:00 AM,,Tibendra Adhikari,"Central Department of Physics, Kirtipur, Kathmandu, Nepal",Remote,Nurapati Pantha,"Central Department of Physics, Kirtipur, Kathmandu, Nepal",First-principles study  of defected silicene for the adsorption of  methane gas molecule,"
First-principles study  of defected silicene for the adsorption of  methane gas molecule

Tibendra Adhikari and Nurapati Pantha
Central Department of Physics, Tribhuvan University, Kirtipur, Kathmandu, Nepal

Considering the significance of natural gas, such as methane, and the difficulties in storing it, research is increasingly focusing on developing materials for solid-state methane storage. Two-dimensional materials have a large number of possible adsorption sites for gas molecules due to their high surface-to-volume ratio.  However, the two-dimensional structure is chemically inactive and attracts nonpolar gases rather weakly [1]. We investigated the methane gas adsorption capabilities of silicene by activating it with different defects [2,3]. According to our density functional theory calculations, the mono-vacancy (MV) defect is advantageous in increasing the binding strength of energy-carrying gases such as methane. In MV defected silicene, methane adsorption energy is detected in the order of the internationally specified energy regime [4].

Acknowledgement
The authors acknowledge the TWAS research grants RG 20- 316 for providing computational help.

References
    1. R. B. Bird, W. E. Stewart, and E. N. Lightfoot, Transport phenomena, Vol. 1 (John Wiley & Sons, 2006).
    2.  S. M. Aghaei, M. M. Monshi, and I. Calizo, RSC Adv. 6, 94417 (2016).
    3. N. Pantha, K. Ulman, and S. Narasimhan, J. Chem. Phys. 153, 244701 (2020).
    4. S. K. Bhatia and A. L. Myers, Langmuir 22, 1688 (2006).
"
07/15/22,Condensed Matter Physics and Material Science,07/15/22,12:00 AM,07/16/22,12:15 AM,,Ram Babu Ray,"Central Department of Physics, Kirtipur, Kathmandu, Nepal",Remote,Gopi Chandra Kaphle,"Central Department of Physics, Kirtipur, Kathmandu, Nepal","Electronic Structures, Magnetic Properties and Strain Effects of Quaternary Heusler Alloy ZrRuTiIn","Electronic Structures, Magnetic Properties and Strain Effects of Quaternary Heusler Alloy
ZrRuTiIn
R. B. Ray 1 and G. C. Kaphle 2
1
Central Department of Physics, Tribhuvan University, Kirtipur,
Kathmandu, Nepal
2
Central Department of Physics, Tribhuvan University, Kirtipur,
Kathmandu, Nepal
*Email: ray-rb@ymail.com
Abstract
Electronic and magnetic properties of quaternary Heusler alloy ZrRuTiIn have been analyzed by using
density functional theory (DFT) based Wien2k approach. The optimized structure of ZrRuTiIn is
obtained through the energy minimization process. The ferromagnetic ground state and
thermodynamical stability of compound is supported by relative total energy and by derived cohesive
energy respectively. From the study, the quaternary Heusler alloy ZrRuTiIn shows half-metallic
ferromagnetic and spin-polarized density of states (DOS). The spin dependent band gap, that is, Half-
metallic gap of ZrRuTiIn is 0.61 eV. We have obtained unsymmetrical nature of DOS in up and down
spin channels. The total spin magnetic moment of ZrRuTiIn is 1.00 ? B , which is integral value
supporting HMF nature of ZrRuTiIn. Detailed study of strain effects of quaternary Heusler alloy
ZrRuTiIn will be comprehensibly presented.
Key words: Quaternary Heusler alloy, Density of states
References
1. F. Dahmane et al., Journal of Superconductivity and Novel Magnetism 28, 2063-2069 (2015).
2. L. Feng et al., Journal of Magnetism and Magnetic Material 351, 92-97 (2014).
3. S. M. Azar et al., Journal of Magnetism and Magnetic Material 10, 324 (2007).
4. Saadi Berri et al., Computational Condensed Matter 1, 26-31 (2014)."
07/15/22,Astronomy and Cosmology,07/15/22,10:15 PM,07/15/22,10:30 PM,,Aayush Gautam,"Birendra Multiple Campus, Tribhuvan University, Nepal",Remote,Angel Bashyal; Shree Krishna Bhattarai; Suman Satyal,"GoldenGate International College, Tribhuvan University, Nepal ; Department of Physics and Optical Science, University of North Carolina at Charlotte ; Department of Physics, University of Texas at Arlington, Box 19059, Arlington, TX 76019, US",Orbital Stability Analysis of Hypothetical Earth-mass and Luna-mass Moons in Sagarmatha (HD 100777) Star System,"Six of the Solar System planets have 150 confirmed moons (Earth – 1, Mars – 2, Jupiter –
53, Saturn – 53, Uranus – 27, Neptune – 14) and 7 of them (Ganymede, Titan, Callisto, Io,
Moon, Europa, Triton) have masses > 0.001M ? . But, no exomoons have been discovered
yet despite the successful detection of 5000 exoplanets. We can infer, based on the Solar
System planets, that these exoplanets are capable of hosting one or multiple exomoons. In
this paper, we study the possible existence of hypothetical Earth-mass and Luna-mass moons
orbiting the Jupiter-mass planet, Laligurans (HD 100777b) in the Sagarmatha (HD 100777)
star system by means of orbital stability. We apply long-term orbital integrations and MEGNO
(Mean Exponential Growth of Nearby Orbits) chaos indicator to study the orbital stability of the
moons and predict a phase-space region comprising of periodic, chaotic, and unstable orbits.
The phase-spaces primarily constitute the moon’s semimajor axis which extends from host
planet’s Roche radius to the Hill radius, and full range of eccentricity. Specific points are picked
from three different regions of MEGNO map and run as single-orbit integration for up to 10
billion period of innermost orbit. Furthermore, the lifetime and maximum eccentricity maps are generated from the direct integration to inspect the stable and unstable orbital configurations.
The analyses of these maps, with the aid of time series plots, show that both moons maintain
stable orbits in the low eccentricity regime and semimajor axis between the Roche limit and
28.4% of Hill radius of the planet."
07/15/22,Astronomy and Cosmology,07/15/22,10:45 PM,07/15/22,11:00 PM,,Prajwal Poudyal,Tri-Chandra Multiple Campus/Tribhuvan University,Remote,Bashudev Bhandari,Tri-Chandra Multiple Campus/Tribhuvan University,Circular Velocities of Milky Way from Classical Cepheids from Gaia and OGLE,"Classical Cepheids are excellent tracers to estimate the rotation velocity of the galaxies
because they provide better distance accuracy with less uncertainty. But, due to the
less budget of radial velocity in spectroscopic surveys, still, we could not compile a large
catalog of them with 6D phase-space. With stringent radial velocity from OGLE DR3
and proper motion from Gaia EDR3, we estimate the rotation velocity of the Milky
Way for number of Classical Cepheids taken from the catalog of Mroz et al: (2019) with precise distance. We present a 3D velocity method to measure rotation velocity up to 20
kpc where we draw 6D phase-space coordinates with high precision even we have fewer
samples. We obtain rotation velocity of 243:38 km/s  ± 0:00 km/s."
07/15/22,Astronomy and Cosmology,07/15/22,11:00 PM,07/15/22,11:15 PM,,Daya Nidhi Chhatkuli,"Central Department of Physics, Tribhuvan University, Nepal",Remote,Sanjaya Paudel;  Binil Aryal.,"Central Department of Physics, Tribhuvan University, Nepal; Centre for Galaxy Evolution Research, Department of Astronomy, Yonsei University, Seoul, South Korea.",Forming Blue Compact Dwarf Galaxy (BCD) Through the Merger,"
We study a sample of compact star-forming dwarf galaxies that are selected from a merging dwarf galaxy catalog. We present a detailed study of their morphological and structural properties. We find that these BCDs-looking galaxies host extended stellar shells and thus are confirmed to be a dwarf-dwarf merger. Their stellar masses range between 8×10^7 M_? and 2×10^9 M_?. Although the extended tail and shell are prominent in the deep optical images, the overall major axis light profile is well modeled with a two-component Sersic function of inner compact and extended outer radii. We calculate the inner and outer component stellar-mass ratio using the two-component modeling. We find an average of merger ratio 1:10 for our sample, indicating these galaxies might have suffered a satellite accretion, which triggers the starburst in the center of the host galaxies. From the measurement of H? equivalent width, we derived the star-formation ages of these galaxies. The derived star-formation ages of these galaxies turn out to be less than 100 M_? yr-1, suggesting the recent ignition of star-formation due to events of satellite interaction.
Key Words: Blue Compact Dwarf Galaxy, Galaxy Merger, Star Burst, Sersic Modelling."
07/15/22,Astronomy and Cosmology,07/15/22,11:15 PM,07/15/22,11:30 PM,,Sanjay Rijal,Tribhuvan University,Remote,Sushila Sigdel,Tribhuvan University,"Study of an Isolated Dust Structure Nearby the White Dwarf WD0011-399 Using IRIS, AKARI and WISE Data","During the asymptotic giant branch (AGB) phase, a major fraction of mass is spread by the stars (0.6 - 10 M{$\odot$}) in the interstellar medium (ISM) in the form of dust. In the left phase of Post-Main Sequence evolution, these dust are found to be surrounding the White Dwarfs (WD). Some small fraction of dust is also formed in the circumstellar shells and cavities around WD which is usually a source of infrared (IR) excess. Formation and evolution of such IR dust structures are the results of high pressure events and such structures are crucial in the study of interaction phenomena in ISM.
 This research project is focused on the study of an isolated dust structure near the white dwarf WD0011-399 located at R.A. (J2000)
 00$^h$ 13$^m$ 47.48$^s$ and Dec. (J2000) -39$^{\circ}$ 37$^{'}$ 24.28$^{''}$ using Improved Reprocessing of the IRAS (IRIS), AKARI and Wide-field Infrared Survey Explorer (WISE) surveys from SkyView Virtual Observatory along with SIMBAD Astronomical Database and Gaia Archive of ESA. The size of the cavity under study is 5.42 pc$\times$2.75 pc, 1.87pc$\times$0.87pc and 1.03$\times$0.51pc with inclination angle of 62.32$^{\circ}$, 65.57$^{\circ}$ and 62.27$^{\circ}$ respectively in IRIS, AKARI and WISE data suggesting that the cavity is neither a face-on nor an edge-on. The relative flux density  of the region has been studied through pixel extraction of FIR images (0.5$^{\circ}$, 30 pixels) and dust color temperature along with dust mass has been calculated. 
Using IRIS data the temperature of the whole region is found between a maximum value 36.82$\pm$4.30 K to a minimum 22.59$\pm$2.32 K with an offset 14.23 K. The average temperature of the region is 28.22$\pm$0.18 K. Following similar procedures for AKARI data, the temperature is found between a maximum of 26.37$\pm$3.56 K and a minimum of 16.32$\pm$1.47 K with an offset of 10.06K. The average temperature is 19.25$\pm$0.15 K. Similarly, using WISE data, the temperature is found between a maximum of 353.72$\pm$18.54 K and a minimum of 307.24$\pm$4.69 K with an offset of 46.48K. The average temperature is 316.62$\pm$0.81 K. High value of offset temperature suggests that the cavity might be evolving with disruptions from background radiative sources. Approximately Gaussian distribution of the temperature in all the surveys implies that the region might be tending towards local thermodynamic equilibrium. The total mass of the structure is estimated to be around 0.03M$_\odot$, 1.6$\times$10$^{-3}$M$_\odot$ and 10$^{-7}$M$_\odot$ using IRIS, AKARI and WISE data respectively. The Jean's mass of the structure was calculated assuming the structure as non-degenerate gas, which was estimated around 2001.93M$_\odot$, 178.44M$_\odot$ and 121.47M$_\odot$ using IRIS, AKARI and WISE data. Since Jean's mass is much greater than the mass of the structure there seems no possibility of star formation within the region of interest.
The color maps show identical distribution for all wavelengths however, no significant relation was observed between dust color temperature and dust mass."
07/15/22,Astronomy and Cosmology,07/15/22,11:30 PM,07/15/22,11:45 PM,,Sushila Sigdel,"Department of Physics, Tri-Chandra Multiple Campus, Tribhuvan University",Remote,Sanjay Rijal,"Department of Physics, Tri-Chandra Multiple Campus","Study of a Bipolar Dust Structure Nearby the White Dwarf PG 1225?079 in IRIS, AKARI and WISE Data","In this work, dust properties around the White Dwarf PG 1225-079 located at RA (J2000): 12h 27m 47.35s, DEC(J2000): -08o 14' 37.97"" is studied extensively using the publicly available data from Improved Reprocessing of IRAS Survey (IRIS), AKARI infrared survey and Wide-field Infrared Survey Explorer (WISE). The bipolar dust structure, hardly resolved in IRIS (60 ?m and 100 ?m), is clearly resolved in AKARI (90 ?m and 140 ?m) and WISE (12 ?m and 22 ?m) image. The dust color temperature and dust mass are calculated from infrared flux density in each bipolar dust structures in all surveys. In IRIS data the average value of dust color temperature in isolated dust structure is 27.57 K. The bipolar isolated upper and lower dust cloud have average temperature; 22.64 K and 22.63 K in AKARI data and 295.34 K and 296.85 K in WISE data respectively. The wide range of temperature suggests the bipolar dust structure is dynamically active. The mass of dust are found to be 6.53×1024 kg in IRIS data, 1.66×1026 kg and 5.60×1026 kg in two bipolar region in AKARI data and 5.48×1025kg and 6.32×1025kg in WISE data. A good correlation is found between the infrared fluxes in all survey with r2value 0.83 in IRIS and more than 0.90 in AKARI and WISE data. SIMBAD database explored few sources including Supernova Remnants nearby the bipolar dust, which might be the progenitor of dust as well as the contributor of energetic radiation. The Gaussian modeling of temperature is found to be distributed Normally. The contour plot of dust color temperature and dust mass shows non-uniform variation among IRIS, AKARI and WISE survey. We have tried to establish the relation between temperature and mass using linear regression.


Keywords: White Dwarf, IRIS, AKARI, WISE, PG 1225-079, Temperature-Mass

"
07/16/22,Atmospheric and Space Physics,07/16/22,7:15 AM,07/16/22,7:45 AM,1,Srikanthan Ramachandran,"Physical Research Laboratory, Ahmedabad, India",Remote,,,Light-absorbing aerosols and climate in South Asia,"Atmospheric warming is leading to an accelerated retreat of glaciers in the Himalayan-Tibetan Plateau region. A major contributor to this warming is the absorption of sunlight by aerosol particles, especially black carbon (BC) and brown carbon (BrC), which are emitted from combustion sources, and natural dust particles, which dominantly contribute to the aerosol mass loading over many continental regions, including parts of the Indo-Gangetic Plains (IGP), the Himalayan foothills and the Tibetan Plateau. However, quantitative determination and attribution of the atmospheric warming produced by these aerosol types has been difficult, especially due to a 50% uncertainty in their contribution to absorption aerosol optical depth (AAOD). Developing effective mitigation options for climate change over South Asia, a major aerosol hot spot, yet vulnerable and relatively poorly-studied region, requires a better quantification of the contributions of absorbing aerosol particles. Aerosols continue to contribute the largest uncertainty in climate change. Over Asia, a global aerosol hotspot, spatial patterns of aerosol emissions are changing mainly because of changes in anthropogenic emissions, producing a dipole in atmospheric aerosol loading between East (decrease in emissions) and South Asia (increase in emissions). The resultant aerosol radiative effects are expected to be different as compared to the last decades of the 20th century because of this emerging Asian aerosol dipole. The projection and assessments of radiative and climate impacts of aerosols rely on simulating accurately the aerosol properties, thus, making it imperative that current climate models involved in climate assessments including the Intergovernmental Panel on Climate Change Assessment Report, simulate well the magnitude and trends in changing aerosol properties. Results obtained for the first time on light-absorbing aerosols using new and high-quality observations, and on the trends in aerosols over Asia and their climate impact from satellites, ground-based observations and simulations from climate models with state-of-the-art treatment of aerosol chemistry, physics and meteorology will be presented."
07/16/22,Atmospheric and Space Physics,07/16/22,7:45 AM,07/16/22,8:00 AM,,Nabin Malakar,"Worcester State University, MA",Remote,,,Environmental Intelligence using Machine Learning Applications,"The big data deluge has presented us with a unique opportunity to observe the environment. Measured by enumerable sensors, which employ the basic physics principles in sensing the environment. These include, but are not limited to remote sensing of air quality, temperature, or other bio-physical variables. Although a great effort has been placed in collecting the data, a greater effort needs to be placed in their societal applications. Machine Learning tools can provide easy access to build such applications. Continuous monitoring and alerting the interested party can prevent some of the undesirable outcomes. As an example, a weather forecast is widely used to predict the temperature/precipitation for a few days in advance.   Similarly, new applications can be developed to practice some of the intelligent decision-making that affects public health. Recent progress in air quality studies is promising to develop such environmental intelligence.   In this presentation, we discuss some of the applications of the relevant datasets for the Environmental Intelligence using Machine Learning Applications."
